informe_global_subscripciones a netflix.md.tables.json

{
  "historical": {
    "2015": 74.76,
    "2016": 93.8,
    "2017": 117.58,
    "2018": 139.26,
    "2019": 167.0,
    "2020": 203.67,
    "2021": 221.84,
    "2022": 230.7,
    "2023": 260.28,
    "2024": 301.6,
    "2025": 325.0
  },
  "models": [
    {
      "name": "Bass Cl\u00e1sico",
      "r2": 0.87131,
      "mape": 17.51,
      "projections": {
        "2026": 318.3720495488993,
        "2027": 329.5724092529699,
        "2028": 339.2919933027673,
        "2029": 347.72657188340247,
        "2030": 355.04603282314514,
        "2031": 361.39780344413356,
        "2032": 366.9098200176263,
        "2033": 371.69310463400194,
        "2034": 375.84400139034284,
        "2035": 379.44611693647903
      }
    },
    {
      "name": "Dual Market",
      "r2": 0.91059,
      "mape": 12.95,
      "projections": {
        "2026": 358.2894180976677,
        "2027": 391.6309235233123,
        "2028": 425.63561723066493,
        "2029": 459.81858145264226,
        "2030": 493.6843482370743,
        "2031": 526.7554936946972,
        "2032": 558.598943733414,
        "2033": 588.8471016738257,
        "2034": 617.2118485218559,
        "2035": 643.4907099779007
      }
    },
    {
      "name": "Fourt-Woodlock",
      "r2": 0.87131,
      "mape": 17.51,
      "projections": {
        "2026": 318.3701524222695,
        "2027": 329.57001099235634,
        "2028": 339.28910900847796,
        "2029": 347.72322142658203,
        "2030": 355.0422393193148,
        "2031": 361.39359204721484,
        "2032": 366.90521697632704,
        "2033": 371.6881365622237,
        "2034": 375.8386947114769,
        "2035": 379.44049746833895
      }
    },
    {
      "name": "Gompertz (Asim\u00e9trico)",
      "r2": 0.99271,
      "mape": 2.48,
      "projections": {
        "2026": 345.7967639320677,
        "2027": 369.12495625433684,
        "2028": 391.28258153212414,
        "2029": 412.1897688988645,
        "2030": 431.80101578701846,
        "2031": 450.0999640558339,
        "2032": 467.09426121257866,
        "2033": 482.8107345552183,
        "2034": 497.29101876163924,
        "2035": 510.5877093468745
      }
    },
    {
      "name": "Bass Generalizado (GBM)",
      "r2": 0.87278,
      "mape": 17.43,
      "projections": {
        "2026": 318.57415228101144,
        "2027": 330.1991755888885,
        "2028": 340.4354549500793,
        "2029": 349.46104672997234,
        "2030": 357.4277639359382,
        "2031": 364.4652666702354,
        "2032": 370.6844621097293,
        "2033": 376.1803357596733,
        "2034": 381.03431303203416,
        "2035": 385.3162318839762
      }
    },
    {
      "name": "Horsky & Simon",
      "r2": 0.87131,
      "mape": 17.51,
      "projections": {
        "2026": 318.3695608143597,
        "2027": 329.569263818721,
        "2028": 339.2882109152162,
        "2029": 347.7221785464993,
        "2030": 355.0410587985913,
        "2031": 361.39228167099805,
        "2032": 366.90378487542586,
        "2033": 371.68659098605,
        "2034": 375.83704385487897,
        "2035": 379.438749342071
      }
    },
    {
      "name": "Muller & Yogev",
      "r2": 0.91059,
      "mape": 12.95,
      "projections": {
        "2026": 358.35569511856704,
        "2027": 391.78401195359623,
        "2028": 425.92044791913423,
        "2029": 460.28657418115563,
        "2030": 494.3906440134006,
        "2031": 527.7556224925429,
        "2032": 559.9453455527706,
        "2033": 590.585939075265,
        "2034": 619.3804794545717,
        "2035": 646.1160549884827
      }
    },
    {
      "name": "Van den Bulte & Joshi",
      "r2": 0.91059,
      "mape": 12.95,
      "projections": {
        "2026": 358.3651334189304,
        "2027": 391.797801202834,
        "2028": 425.93518838205836,
        "2029": 460.29686073467656,
        "2030": 494.38931696422225,
        "2031": 527.7342235967989,
        "2032": 559.8947168517527,
        "2033": 590.4968807009669,
        "2034": 619.2443788497083,
        "2035": 645.9254137043333
      }
    },
    {
      "name": "Modelo Log\u00edstico de Convergencia",
      "r2": 0.99113,
      "mape": 3.13,
      "projections": {
        "2026": 341.2047901147697,
        "2027": 359.68414066780707,
        "2028": 375.5916510092177,
        "2029": 389.0470875845987,
        "2030": 400.2605398936329,
        "2031": 409.49041038732616,
        "2032": 417.01035020102546,
        "2033": 423.08630162513464,
        "2034": 427.9625739263049,
        "2035": 431.85492099324927
      }
    },
    {
      "name": "Ladr\u00f3n-de-Guevara & Putsis",
      "r2": 0.87131,
      "mape": 17.51,
      "projections": {
        "2026": 318.37472167209893,
        "2027": 329.5757928109839,
        "2028": 339.29606702880704,
        "2029": 347.73130770140375,
        "2030": 355.0513980193892,
        "2031": 361.40376238381265,
        "2032": 366.916335488686,
        "2033": 371.70013888678716,
        "2034": 375.8515169299724,
        "2035": 379.4540771151471
      }
    }
  ]
}

informe_global_netflix.md

### 2. Evaluación Comparativa de las Dinámicas de Mercado

La serie histórica de adopción acumulada para netflix es la siguiente:
*   2015: 70.0M suscriptores
*   2016: 93.8M suscriptores
*   2017: 117.6M suscriptores
*   2018: 139.3M suscriptores
*   2019: 167.1M suscriptores
*   2020: 200.0M suscriptores
*   2021: 221.8M suscriptores
*   2022: 230.7M suscriptores
*   2023: 260.9M suscriptores
*   2024: 275.0M suscriptores
*   2025: 288.0M suscriptores